{
  "study_id": "VTX-330-201",
  "site_id": null,
  "investigator": "Elena Park",
  "payment_to_remittance": [],
  "invoice_to_payment": [
    {
      "invoice_id": "invoice-76ef2e64d29b",
      "payment_ids": [],
      "invoice_amount": 10842.50,
      "amount_settled": 10842.50,
      "status": "paid"
    },
    {
      "invoice_id": "invoice-9d4873801ed4",
      "payment_ids": [],
      "invoice_amount": 2940.60,
      "amount_settled": 2940.60,
      "status": "paid"
    }
  ],
  "invoice_to_activities": [
    {
      "invoice_id": "invoice-76ef2e64d29b",
      "activity_ids": []
    },
    {
      "invoice_id": "invoice-9d4873801ed4",
      "activity_ids": []
    }
  ],
  "remittance_to_activities": [
    {
      "remittance_id": "remittance-4288c6d9ad31",
      "lines": [
        {
          "activity_id": null,
          "invoice_id": "invoice-76ef2e64d29b",
          "amount_allocated": 10842.50
        }
      ]
    },
    {
      "remittance_id": "remittance-5f39b49508c1",
      "lines": [
        {
          "activity_id": null,
          "invoice_id": "invoice-9d4873801ed4",
          "amount_allocated": 2940.60
        }
      ]
    }
  ],
  "activity_to_cta": [
    {
      "activity_id": "activity-fdc950302833",
      "cta_visit_label": "Screening",
      "cta_amount": 685.40,
      "match_confidence": "HIGH"
    },
    {
      "activity_id": "activity-38c9342a93c9",
      "cta_visit_label": "V1",
      "cta_amount": 418.75,
      "match_confidence": "HIGH"
    },
    {
      "activity_id": "activity-4923c9ae2452",
      "cta_visit_label": "V2",
      "cta_amount": 842.60,
      "match_confidence": "HIGH"
    },
    {
      "activity_id": "activity-ac0355028f0a",
      "cta_visit_label": "Screening",
      "cta_amount": 685.40,
      "match_confidence": "HIGH"
    },
    {
      "activity_id": "activity-8cbf9c860949",
      "cta_visit_label": "V1",
      "cta_amount": 418.75,
      "match_confidence": "HIGH"
    },
    {
      "activity_id": "activity-c79943339ff8",
      "cta_visit_label": "Screening",
      "cta_amount": 685.40,
      "match_confidence": "HIGH"
    },
    {
      "activity_id": "activity-3741c83ea2a5",
      "cta_visit_label": "V1",
      "cta_amount": 418.75,
      "match_confidence": "HIGH"
    },
    {
      "activity_id": "activity-c261fde947c7",
      "cta_visit_label": "V2",
      "cta_amount": 842.60,
      "match_confidence": "HIGH"
    },
    {
      "activity_id": "activity-349df7cdb4ef",
      "cta_visit_label": "V3",
      "cta_amount": 523.10,
      "match_confidence": "HIGH"
    },
    {
      "activity_id": "activity-ae5ccadc5a21",
      "cta_visit_label": "Screening",
      "cta_amount": 685.40,
      "match_confidence": "HIGH"
    },
    {
      "activity_id": "activity-bf972d56f218",
      "cta_visit_label": "V1",
      "cta_amount": 418.75,
      "match_confidence": "HIGH"
    },
    {
      "activity_id": "activity-09e426fd5c53",
      "cta_visit_label": "Screening",
      "cta_amount": 685.40,
      "match_confidence": "HIGH"
    },
    {
      "activity_id": "activity-369c84c8a269",
      "cta_visit_label": null,
      "cta_amount": null,
      "match_confidence": null
    },
    {
      "activity_id": "activity-465fd06e563a",
      "cta_visit_label": null,
      "cta_amount": null,
      "match_confidence": null
    },
    {
      "activity_id": "activity-1f05b999a1fd",
      "cta_visit_label": null,
      "cta_amount": null,
      "match_confidence": null
    }
  ],
  "entity_scope": [
    {
      "entity_type": "invoice",
      "entity_id": "invoice-76ef2e64d29b",
      "study_id": "VTX-330-201",
      "site_id": null,
      "investigator": null
    },
    {
      "entity_type": "invoice",
      "entity_id": "invoice-9d4873801ed4",
      "study_id": "VTX-330-201",
      "site_id": null,
      "investigator": null
    },
    {
      "entity_type": "remittance",
      "entity_id": "remittance-4288c6d9ad31",
      "study_id": "VTX-330-201",
      "site_id": null,
      "investigator": null
    },
    {
      "entity_type": "remittance",
      "entity_id": "remittance-5f39b49508c1",
      "study_id": "VTX-330-201",
      "site_id": null,
      "investigator": null
    },
    {
      "entity_type": "activity",
      "entity_id": "activity-fdc950302833",
      "study_id": "VTX-330-201",
      "site_id": null,
      "investigator": null
    },
    {
      "entity_type": "activity",
      "entity_id": "activity-38c9342a93c9",
      "study_id": "VTX-330-201",
      "site_id": null,
      "investigator": null
    },
    {
      "entity_type": "activity",
      "entity_id": "activity-4923c9ae2452",
      "study_id": "VTX-330-201",
      "site_id": null,
      "investigator": null
    },
    {
      "entity_type": "activity",
      "entity_id": "activity-ac0355028f0a",
      "study_id": "VTX-330-201",
      "site_id": null,
      "investigator": null
    },
    {
      "entity_type": "activity",
      "entity_id": "activity-8cbf9c860949",
      "study_id": "VTX-330-201",
      "site_id": null,
      "investigator": null
    },
    {
      "entity_type": "activity",
      "entity_id": "activity-c79943339ff8",
      "study_id": "VTX-330-201",
      "site_id": null,
      "investigator": null
    },
    {
      "entity_type": "activity",
      "entity_id": "activity-3741c83ea2a5",
      "study_id": "VTX-330-201",
      "site_id": null,
      "investigator": null
    },
    {
      "entity_type": "activity",
      "entity_id": "activity-c261fde947c7",
      "study_id": "VTX-330-201",
      "site_id": null,
      "investigator": null
    },
    {
      "entity_type": "activity",
      "entity_id": "activity-349df7cdb4ef",
      "study_id": "VTX-330-201",
      "site_id": null,
      "investigator": null
    },
    {
      "entity_type": "activity",
      "entity_id": "activity-ae5ccadc5a21",
      "study_id": "VTX-330-201",
      "site_id": null,
      "investigator": null
    },
    {
      "entity_type": "activity",
      "entity_id": "activity-bf972d56f218",
      "study_id": "VTX-330-201",
      "site_id": null,
      "investigator": null
    },
    {
      "entity_type": "activity",
      "entity_id": "activity-09e426fd5c53",
      "study_id": "VTX-330-201",
      "site_id": null,
      "investigator": null
    },
    {
      "entity_type": "activity",
      "entity_id": "activity-369c84c8a269",
      "study_id": "VTX-330-201",
      "site_id": null,
      "investigator": null
    },
    {
      "entity_type": "activity",
      "entity_id": "activity-465fd06e563a",
      "study_id": "VTX-330-201",
      "site_id": null,
      "investigator": null
    },
    {
      "entity_type": "activity",
      "entity_id": "activity-1f05b999a1fd",
      "study_id": "VTX-330-201",
      "site_id": null,
      "investigator": null
    }
  ]
}