{
  "study_id": "CLX-115-300",
  "site_id": null,
  "investigator": "Dana Whitfield",
  "payment_to_remittance": [
    {
      "payment_id": "payment-7fe2aac8e6ca",
      "remittance_ids": [
        "remittance-0c6356923ecf"
      ]
    },
    {
      "payment_id": "payment-8bf04e640d53",
      "remittance_ids": [
        "remittance-a779828a3ee0"
      ]
    }
  ],
  "invoice_to_payment": [
    {
      "invoice_id": "invoice-a0646d87ac24",
      "payment_ids": [
        "payment-8bf04e640d53"
      ],
      "invoice_amount": 742.30,
      "amount_settled": 742.30,
      "status": "paid"
    },
    {
      "invoice_id": "invoice-985a80e84c5d",
      "payment_ids": [
        "payment-8bf04e640d53"
      ],
      "invoice_amount": 518.60,
      "amount_settled": 518.60,
      "status": "paid"
    },
    {
      "invoice_id": "invoice-7735104a8d48",
      "payment_ids": [
        "payment-8bf04e640d53"
      ],
      "invoice_amount": 742.30,
      "amount_settled": 742.30,
      "status": "paid"
    },
    {
      "invoice_id": "invoice-ff871c9ae78b",
      "payment_ids": [
        "payment-8bf04e640d53"
      ],
      "invoice_amount": 518.60,
      "amount_settled": 518.60,
      "status": "paid"
    },
    {
      "invoice_id": "invoice-b16d8ddef7c7",
      "payment_ids": [
        "payment-7fe2aac8e6ca"
      ],
      "invoice_amount": 6284.50,
      "amount_settled": 6284.50,
      "status": "paid"
    }
  ],
  "invoice_to_activities": [
    {
      "invoice_id": "invoice-a0646d87ac24",
      "activity_ids": [
        "activity-6554f43a9a3a"
      ]
    },
    {
      "invoice_id": "invoice-985a80e84c5d",
      "activity_ids": [
        "activity-6a3c38ae7a59"
      ]
    },
    {
      "invoice_id": "invoice-7735104a8d48",
      "activity_ids": [
        "activity-bec983ada201"
      ]
    },
    {
      "invoice_id": "invoice-ff871c9ae78b",
      "activity_ids": [
        "activity-69bf0c3180ad"
      ]
    },
    {
      "invoice_id": "invoice-b16d8ddef7c7",
      "activity_ids": []
    }
  ],
  "remittance_to_activities": [
    {
      "remittance_id": "remittance-0c6356923ecf",
      "lines": [
        {
          "activity_id": null,
          "invoice_id": "invoice-b16d8ddef7c7",
          "amount_allocated": 6284.50
        }
      ]
    },
    {
      "remittance_id": "remittance-a779828a3ee0",
      "lines": [
        {
          "activity_id": null,
          "invoice_id": "invoice-a0646d87ac24",
          "amount_allocated": 742.30
        },
        {
          "activity_id": null,
          "invoice_id": "invoice-985a80e84c5d",
          "amount_allocated": 518.60
        },
        {
          "activity_id": null,
          "invoice_id": "invoice-7735104a8d48",
          "amount_allocated": 742.30
        },
        {
          "activity_id": null,
          "invoice_id": "invoice-ff871c9ae78b",
          "amount_allocated": 518.60
        }
      ]
    }
  ],
  "activity_to_cta": [
    {
      "activity_id": "activity-6554f43a9a3a",
      "cta_visit_label": "Screening Visit",
      "cta_amount": 742.30,
      "match_confidence": "HIGH"
    },
    {
      "activity_id": "activity-6a3c38ae7a59",
      "cta_visit_label": "Visit 1",
      "cta_amount": 518.60,
      "match_confidence": "HIGH"
    },
    {
      "activity_id": "activity-bec983ada201",
      "cta_visit_label": "Screening Visit",
      "cta_amount": 742.30,
      "match_confidence": "HIGH"
    },
    {
      "activity_id": "activity-69bf0c3180ad",
      "cta_visit_label": "Visit 1",
      "cta_amount": 518.60,
      "match_confidence": "HIGH"
    },
    {
      "activity_id": "activity-6df8a060d30e",
      "cta_visit_label": "Visit 2",
      "cta_amount": 463.75,
      "match_confidence": "HIGH"
    }
  ],
  "entity_scope": [
    {
      "entity_type": "invoice",
      "entity_id": "invoice-a0646d87ac24",
      "study_id": "CLX-115-300",
      "site_id": null,
      "investigator": null
    },
    {
      "entity_type": "invoice",
      "entity_id": "invoice-985a80e84c5d",
      "study_id": "CLX-115-300",
      "site_id": null,
      "investigator": null
    },
    {
      "entity_type": "invoice",
      "entity_id": "invoice-7735104a8d48",
      "study_id": "CLX-115-300",
      "site_id": null,
      "investigator": null
    },
    {
      "entity_type": "invoice",
      "entity_id": "invoice-ff871c9ae78b",
      "study_id": "CLX-115-300",
      "site_id": null,
      "investigator": null
    },
    {
      "entity_type": "invoice",
      "entity_id": "invoice-b16d8ddef7c7",
      "study_id": "CLX-115-300",
      "site_id": null,
      "investigator": null
    },
    {
      "entity_type": "payment",
      "entity_id": "payment-7fe2aac8e6ca",
      "study_id": "CLX-115-300",
      "site_id": null,
      "investigator": null
    },
    {
      "entity_type": "payment",
      "entity_id": "payment-8bf04e640d53",
      "study_id": "CLX-115-300",
      "site_id": null,
      "investigator": null
    },
    {
      "entity_type": "remittance",
      "entity_id": "remittance-0c6356923ecf",
      "study_id": "CLX-115-300",
      "site_id": null,
      "investigator": null
    },
    {
      "entity_type": "remittance",
      "entity_id": "remittance-a779828a3ee0",
      "study_id": "CLX-115-300",
      "site_id": null,
      "investigator": null
    },
    {
      "entity_type": "activity",
      "entity_id": "activity-6554f43a9a3a",
      "study_id": "CLX-115-300",
      "site_id": null,
      "investigator": null
    },
    {
      "entity_type": "activity",
      "entity_id": "activity-6a3c38ae7a59",
      "study_id": "CLX-115-300",
      "site_id": null,
      "investigator": null
    },
    {
      "entity_type": "activity",
      "entity_id": "activity-bec983ada201",
      "study_id": "CLX-115-300",
      "site_id": null,
      "investigator": null
    },
    {
      "entity_type": "activity",
      "entity_id": "activity-69bf0c3180ad",
      "study_id": "CLX-115-300",
      "site_id": null,
      "investigator": null
    },
    {
      "entity_type": "activity",
      "entity_id": "activity-6df8a060d30e",
      "study_id": "CLX-115-300",
      "site_id": null,
      "investigator": null
    }
  ]
}